{
  "protocol_version": 1,
  "request_id": "req-000001",
  "request_digest": "365ec86ddd5cda3e9b6cb5771581ed742ff7d03829267ec6be3aef31a32da167",
  "attempt_id": "attempt-000001",
  "gateway_source_sha": "cccccccccccccccccccccccccccccccccccccccc",
  "command_status": "completed",
  "exit_code": 0,
  "started_at": "2026-09-02T18:00:01Z",
  "finished_at": "2026-09-02T18:00:02Z",
  "duration_ms": 1000,
  "stdout": {
    "sha256": "d117fa006ba9208500b2930ce69cbde436c647afa917cb7396a9bc9111a46dd2",
    "total_bytes": 5,
    "retained_bytes": 5,
    "truncated": false
  },
  "stderr": {
    "sha256": "e3b0c44298fc1c149afbf4c8996fb92427ae41e4649b934ca495991b7852b855",
    "total_bytes": 0,
    "retained_bytes": 0,
    "truncated": false
  },
  "artifacts": {
    "status": "complete",
    "files": [
      {
        "group": "test-results",
        "path": "test-results/example.png",
        "sha256": "ffffffffffffffffffffffffffffffffffffffffffffffffffffffffffffffff",
        "size_bytes": 128
      }
    ],
    "omissions": []
  }
}
